code,name,yield_sum,yield_mean
7210,Freight Management Holdings (FMHB),25.05,8.35
8621,LPI Capital Bhd (LOND),24.66,8.22
7200,Tek Seng Holdings Bhd (TSHB),22.34,7.44667
7233,Dufu Tech Corp Bhd (DUFU),21.69,7.23
7149,Eng Kah Corporation Bhd (ENGH),21.18,7.06
5246,Westports Holdings Bhd (WPHB),20.89,6.96333
7668,Hai O Enterprise Bhd (HAIO),20.82,6.94
5371,Kim Hin Industry Bhd (KIMH),20.07,6.69
5592,Grand Central Enterprises Bhd (GRAN),19.45,3.89
8494,LBI Capital Bhd (LBIP),19.27,6.42333
9598,Pintaras Jaya Bhd (PINT),18.77,9.385
6718,Crescendo Corporation Bhd (CREC),18.71,6.23667
9571,Mitrajaya Holdings Bhd (MITR),17.96,5.98667
7076,CB Industrial Product Holding (CBIP),17.56,5.85333
9873,Prestar Resources Bhd (PTAR),17.54,5.84667
7229,Favelle Favco Bhd (FVCO),16.9,5.63333
5263,Sunway Construction Group Bhd (SCOG),16.86,5.62
5398,Gamuda Bhd (GAMU),16.84,5.61333
5886,Mintye Industries Bhd (MINT),16.81,3.362
6432,Apollo Food Holdings Bhd (AFHB),16.63,5.54333
7085,LTKM Bhd (LTKM),16.46,5.48667
7140,Oka Corporation Bhd (OKAC),16.4,5.46667
7247,SCGM Bhd (SCGB),16.26,8.13
8583,Mah Sing Group Bhd (MAHS),16.19,5.39667
7148,CCM Duopharma Biotech Bhd (CCMD),16.12,5.37333
6351,Amway (Malaysia) Holdings Bhd (AMWA),16.09,8.045
7167,Johore Tin Bhd (JHTN),16.08,5.36
7087,Magni Tech Industries Bhd (MATE),15.9,5.3
7248,SLP Resources Bhd (SLPB),15.78,5.26
6742,YTL Power International Bhd (YTLP),15.73,5.24333
7060,New Hoong Fatt Holdings Bhd (NHFH),15.64,5.21333
6491,Kumpulan Fima Bhd (KFIM),15.56,5.18667
9172,Formosa Prosonic Industries (FPIB),15.49,5.16333
5347,Tenaga Nasional Bhd (TENA),15.36,5.12
7205,Cocoaland Holdings Bhd (CCLD),15.2,5.06667
5276,Dancomech Holdings Bhd (DNCO),14.77,4.92333
6521,Suria Capital Holdings Bhd (SURI),14.69,4.89667
8311,Pesona Metro Holdings Bhd (PESO),14.6,4.86667
5271,Pecca Group Bhd (PECC),14.44,4.81333
7106,Supermax Corporation Bhd (SUPM),14.21,4.73667
5230,Tune Protect Group Bhd (TUNE),14.18,4.72667
7803,Rubberex Corporation M Bhd (RUMM),14.05,4.68333
7412,SHH Resources Holdings Bhd (SHHR),13.88,6.94
7100,Uchi Technologies Bhd (UCHI),13.87,6.935
5819,Hong Leong Bank Bhd (HLBB),13.6,4.53333
7090,Apex Healthcare Bhd (APER),13.49,4.49667
5401,Tropicana Corporation Bhd (TROP),13.47,4.49
8591,Crest Builder Holdings Bhd (CREH),13.33,4.44333
9997,Pensonic Holdings Bhd (PENS),12.85,6.425
7617,Magna Prima Bhd (MAGN),12.84,6.42
7117,CJ Century Logistics Holdings Bhd (CJCE),12.76,4.25333
9962,Gromutual Bhd (GMUT),12.76,6.38
7052,Padini Holdings Bhd (PDNI),12.73,6.365
6888,Axiata Group Bhd (AXIA),12.47,4.15667
8125,Daibochi Bhd (DAIB),12.26,6.13
7235,Superlon Holdings Bhd (SPLH),11.88,3.96
7113,Top Glove Corporation Bhd (TPGC),11.87,3.95667
6139,Syarikat Takaful Malaysia Bhd (TAKA),11.64,3.88
9296,RCE Capital Berhad (REDI),11.53,3.84333
6399,Astro Malaysia Holdings Bhd (ASTR),11.52,5.76
6262,Innoprise Plantations Bhd (INNO),11.37,5.685
5983,MBM Resources Bhd (MBMR),11.33,3.77667
7201,Progressive Impact Corporation Bhd (PGSV),11.21,3.73667
5273,Chin Hin Group Bhd (CHIU),11.15,5.575
7129,Asia File Corporation Bhd (AFCB),11.04,5.52
7034,Thong Guan Industries Bhd (TGIB),11.02,3.67333
9369,Teo Guan Lee Corporation Bhd (TGLB),10.92,5.46
6939,Fiamma Holdings Bhd (FIAM),10.71,3.57
9792,SEG International Bhd (SEDU),10.56,5.28
5517,Shangri La Hotels Malaysia Bhd (SHGM),10.55,3.51667
6149,Metrod Holdings Bhd (MROD),10.47,3.49
5789,LBS Bina Group Bhd (LBSB),10.47,3.49
5568,APB Resources Bhd (APBS),10.45,5.225
8702,Texchem Resources Bhd (TEXC),10.42,10.42
5878,KPJ Healthcare Bhd (KPJH),10.4,5.2
7757,UPA Corporation Bhd (UPAB),10.26,3.42
6874,KUB Malaysia Bhd (KUBM),10.16,3.38667
7190,Pelangi Publishing Group Bhd (PPGB),10.11,3.37
8966,Prolexus Bhd (PXUS),10.07,3.35667
9423,Chee Wah Corporation Bhd (CWGH),9.72,4.86
7246,Signature International Bhd (SGNA),9.62,4.81
8648,Jasa Kita Bhd (JKBM),9.57,4.785
6238,Hock Seng Lee Bhd (HSLB),9.3,3.1
7323,Ken Holdings Bhd (KENH),9.3,3.1
7155,SKP Resources Bhd (SKPR),9.21,3.07
7091,Unimech Group Bhd (UMEC),9.02,3.00667
7231,Wellcall Holdings Bhd (WCAL),8.98,8.98
5843,Kumpulan Perangsang Selangor (KPSB),8.81,2.93667
7119,DeGem Bhd (DEGM),8.62,2.87333
6645,Lingkaran Trans Kota Holdings Bhd (LTKH),8.57,4.285
9199,Lysaght Galvanized Steel Bhd (LYSA),8.57,2.85667
7207,Success Transformer Corporation Bhd (SCCE),8.55,4.275
5681,Petronas Dagangan Bhd (PETR),8.45,8.45
7203,Wang-Zheng Bhd (WGZH),8.27,2.75667
7227,UMS-Neiken Group Bhd (UMSN),8.19,2.73
6041,Farlim Group (Malaysia) Bhd (FLIM),8.18,4.09
7152,Jaycorp Bhd (JAYC),8.13,8.13
8,Willowglen MSC Bhd (WLOW),8.04,2.68
7133,United U Li Corporation Bhd (UULI),8,4
83,Notion Vtec Bhd (NVTE),7.95,7.95
6483,K N Kenanga Holdings Bhd (KNNK),7.9,3.95
7178,YSP Southeast Asia Holding Bhd (YSPS),7.87,2.62333
7134,PW Consolidated Bhd (PWFC),7.8,3.9
5280,KIP Real Estate Investment Trust (KIPR),7.78,7.78
7153,Kossan Rubber Industries Bhd (KRIB),7.77,2.59
5253,Econpile Holdings Bhd (ECOH),7.69,2.56333
8133,Boustead Heavy Industries (BHIB),7.69,3.845
8419,Pansar Bhd (PANS),7.65,2.55
7245,WZ Satu Bhd (WZRB),7.49,2.49667
8869,Press Metal Bhd (PMET),7.46,3.73
7609,Ajiya Bhd (AJIY),7.42,2.47333
58,JCBNext Berhad Bhd (JCBN),7.32,2.44
7103,Spritzer Bhd (SPTZ),7.25,2.41667
6114,MKH Bhd (METR),7.21,3.605
7137,UMS Holdings Bhd (UMSH),7.17,2.39
7214,A Rank Bhd (ARNK),7.12,3.56
5797,Choo Bee Metal Industries Bhd (CHOO),7.11,2.37
7172,PMB Technology Bhd (PMBT),7.05,3.525
5908,DKSH Holdings Malaysia Berhad (DELM),7.03,2.34333
9326,LB Aluminium Bhd (LBAL),6.94,3.47
5249,IOI Properties Group Bhd (IOIP),6.93,3.465
7082,SYF Resources Bhd (SYFR),6.82,3.41
7202,Classic Scenic Bhd (CSCB),6.8,6.8
5827,Oriental Interest Bhd (OINT),6.74,3.37
7107,Oriental Food Industries Hold (OFIH),6.68,3.34
7016,Chuan Huat Resources Bhd (CHRB),6.59,3.295
5232,Leon Fuat Bhd (LEON),6.57,2.19
5258,BIMB Holdings Bhd (BIMB),6.56,3.28
7029,Master Pack Group Bhd (MSTP),6.56,2.18667
8982,Cepatwawasan Group Bhd (CPWA),6.34,2.11333
5264,Malakoff Corporation Bhd (MALA),6.29,6.29
9261,Gadang Holdings Bhd (GADA),6.27,3.135
5278,Rhone Ma Holdings Bhd (RHON),6.22,6.22
5277,FoundPac Group Bhd (FOUN),6.17,3.085
7285,Tomypak Holdings Bhd (TOMY),6.11,6.11
7033,Kumpulan H & L High-Tech Bhd (KHLH),6.02,3.01
6181,Malton Bhd (MLTO),5.99,2.995
5703,Muhibbah Engineering M Bhd (MUHI),5.89,1.96333
8443,Hil Industries Bhd (HILI),5.84,1.94667
7006,Latitude Tree Holdings Bhd (LTHB),5.83,2.915
6556,Ann Joo Resources Bhd (ANNJ),5.7,5.7
7161,Kerjaya Prospek Group Bhd (KREJ),5.61,1.87
6769,JKG Land Bhd (JKGL),5.5,1.83333
7035,CCK Consolidated Holdings Bhd (CCKH),5.41,1.80333
7048,Atlan Holdings Bhd (ATLA),5.39,5.39
9822,Sam Engineering Equipment (SAEG),5.36,1.78667
5584,Yee Lee Corporation Bhd (YLEE),5.34,1.78
7528,DKLS Industries Bhd (DKLS),5.32,1.77333
7277,Dialog Group Bhd (DIAL),5.3,1.76667
8664,SP Setia Bhd (SETI),5.24,5.24
7222,Imaspro Corporation Bhd (IMSP),5.19,2.595
7579,AWC Bhd (AWCF),4.97,2.485
5227,IGB Real Estate Investment Trust (IGRE),4.93,4.93
8397,Tiong Nam Logistics Holdings Bhd (TNTT),4.92,2.46
5250,7 Eleven Malaysia Holdings Bhd (SEVE),4.91,1.63667
6599,AEON Co (Malaysia) Bhd (AEOM),4.89,1.63
7022,Globetronics Tech Bhd (GNIC),4.89,1.63
6173,Bina Darulaman Bhd (BDBS),4.85,4.85
5355,Daiman Develop Bhd (DAIM),4.84,2.42
65,Excel Force MSC Bhd (EXFM),4.77,2.385
7199,Kein Hing International Bhd (KEHG),4.74,2.37
8877,Ekovest Bhd (EKOV),4.72,2.36
7811,Sapura Industrial Bhd (SAPU),4.71,4.71
9288,Bonia Corporation Bhd (BONI),4.66,2.33
7078,Ahmad Zaki Resources Bhd (AZRB),4.65,2.325
7162,Astino Bhd (ATNO),4.65,1.55
7055,PLB Engineering Bhd (PLBE),4.57,2.285
8605,Federal International Holdings Bhd (FIHB),4.47,2.235
9148,Advanced Packaging Tech (Malaysia) (APTB),4.43,4.43
7095,PIE Industrial Bhd (PIEN),4.3,1.43333
9059,TSH Resources Bhd (TSHR),4.3,1.43333
5269,Al-Salam Real Estate Investment Trust (ALSA),4.22,4.22
7154,Caely Holdings Bhd (CAEY),4.21,1.40333
6203,Khee San Bhd (KHEE),3.93,1.965
7374,Tien Wah Press Holdings Bhd (TWPH),3.87,3.87
7293,Yinson Holdings Bhd (YINS),3.71,1.23667
5665,Southern Steel Bhd (STEE),3.67,1.835
5916,Malaysia Smelting Corporation Bhd (MSCB),3.62,1.81
5533,OCB Bhd (OCBB),3.57,1.785
7099,Atta Global Group Bhd (ATTA),3.57,3.57
8761,Brem Holding Bhd (BREM),3.49,1.745
6963,VS Industry Bhd (VSID),3.47,3.47
8834,Ireka Corporation Bhd (IRKA),3.42,3.42
5223,Mentiga Corporation Bhd (MENT),3.41,1.705
5252,Sasbadi Holdings Bhd (SAHO),3.39,3.39
7088,Poh Huat Resources Holdings (PHUA),3.24,3.24
5275,myNEWS Holdings Bhd (MYNE),3.23,0.646
7083,Analabs Resources Bhd (ANRE),3.19,1.06333
5268,Ikhmas Jaya Group Bhd (IKHM),3.09,1.545
97,ViTrox Corporation Bhd (VTRX),2.97,0.99
7209,Cheetah Holdings Bhd (CETH),2.9,1.45
7111,Weida (M) Bhd (WEID),2.89,1.445
7216,Kawan Food Bhd (KWNF),2.88,0.96
7249,Ewein Bhd (EWEI),2.8,0.933333
9334,KESM Industries Bhd (KESM),2.79,0.93
8079,Lee Swee Kiat Group Bhd (LHTM),2.76,1.38
5245,Caring Pharmacy Group Bhd (CARI),2.64,1.32
9431,Seni Jaya Corporation Bhd (SENI),2.59,1.295
5225,IHH Healthcare Bhd (IHHH),2.54,0.508
5247,Karex (KARE),2.53,1.265
9741,Rohas Tecnic Bhd (ROHA),2.4,1.2
5242,Solid Automotive Bhd (SOIL),2.27,2.27
5226,Gabungan AQRS Bhd (GAQR),2.24,1.12
7004,MCE Holdings Bhd (MCEI),2.19,2.19
7382,Golden Land Bhd (GOLD),2.17,2.17
5267,Xin Hwa Holdings Bhd (XINW),2.17,1.085
7084,QL Resources Bhd (QRES),2.15,0.716667
7189,MB World Group Bhd (MBWO),2.02,2.02
9385,Lay Hong Bhd (LAYH),1.91,0.636667
9865,Suiwah Corporation Bhd (SWAH),1.65,0.825
78,GD Express Carrier Bhd (GDEX),1.6,0.533333
7014,YLI Holdings Bhd (YLIH),1.54,1.54
5606,IGB Bhd (IGBB),1.4,0.7
7168,Prg Holdings Bhd (PRGH),1.2,0.6
9946,Rex Industry Bhd (REXI),1.04,1.04
5239,Titijaya Land Bhd (TITI),0.98,0.49
7174,CAB Cakaran Corporation Bhd (CABC),0.89,0.445
